[
  {
    "id": "frag_sg_border_revolt_suppress_success",
    "node": "sg_border_revolt",
    "choice": "suppress",
    "result": "success",
    "kind": "historical",
    "text": "당신의 기병이 평원을 가로질러 부족 연합의 진영을 흩어 놓는다. 부족장들은 이듬해부터 세금을 다시 바치기로 한다. 성주는 당신의 이름을 수도에 보고한다.",
    "endingLine": "변방의 봉기는 당신의 기병에 진압된다.",
    "sources": [
      "가상 데이터 — 실제 사료 아님"
    ]
  },
  {
    "id": "frag_sg_border_revolt_suppress_failure",
    "node": "sg_border_revolt",
    "choice": "suppress",
    "result": "failure",
    "kind": "alternate",
    "text": "기병의 돌격이 진흙에 막혀 멈춘다. 당신은 어깨에 화살을 맞고 성채로 물러난다. 부족 연합은 평원을 차지한 채 겨울을 난다."
  },
  {
    "id": "frag_sg_border_revolt_ally_success",
    "node": "sg_border_revolt",
    "choice": "ally",
    "result": "success",
    "kind": "alternate",
    "text": "당신은 무기를 내려놓고 부족장의 천막으로 들어간다. 세금을 줄이는 대신 부족 기병이 성채를 함께 지키기로 한다. 변방의 길이 다시 열린다.",
    "endingLine": "변방 부족은 당신의 동맹이 된다."
  },
  {
    "id": "frag_sg_border_revolt_ally_failure",
    "node": "sg_border_revolt",
    "choice": "ally",
    "result": "failure",
    "kind": "alternate",
    "text": "부족장들은 당신의 조건을 거절한다. 돌아오는 길에 매복을 만나 당신은 다리를 다친다. 이후 부족들은 서련국을 적으로 여긴다."
  },
  {
    "id": "frag_sg_border_revolt_wait_success",
    "node": "sg_border_revolt",
    "choice": "wait",
    "result": "success",
    "kind": "alternate",
    "text": "당신은 성문을 걸어 잠그고 창고의 곡식을 나눈다. 겨울이 깊어지자 부족 연합은 스스로 흩어진다. 봉기의 원인이던 세금 문제는 그대로 남는다."
  },
  {
    "id": "frag_sg_border_revolt_wait_failure",
    "node": "sg_border_revolt",
    "choice": "wait",
    "result": "failure",
    "kind": "alternate",
    "text": "성안의 곡식이 예상보다 빨리 바닥난다. 부족 연합은 주변 마을을 차지하고 봄을 맞는다. 변방의 민심이 성채에서 멀어진다."
  },
  {
    "id": "frag_sg_capital_coup_loyal_success",
    "node": "sg_capital_coup",
    "choice": "loyal",
    "result": "success",
    "kind": "historical",
    "text": "당신은 밤낮으로 행군해 수도의 성문 앞에 선다. 수비대가 성문을 열고 재상 일파는 달아난다. 왕은 병상에서 당신에게 병권을 맡긴다.",
    "endingLine": "당신은 정변을 진압하고 왕을 지킨다.",
    "sources": [
      "가상 데이터 — 실제 사료 아님"
    ]
  },
  {
    "id": "frag_sg_capital_coup_loyal_failure",
    "node": "sg_capital_coup",
    "choice": "loyal",
    "result": "failure",
    "kind": "alternate",
    "text": "행군 도중 보급로가 끊긴다. 당신이 수도에 닿았을 때 성문 위에는 이미 재상의 깃발이 걸려 있다. 당신은 부상을 입은 채 패잔병을 이끌고 변방으로 돌아간다."
  },
  {
    "id": "frag_sg_capital_coup_join_success",
    "node": "sg_capital_coup",
    "choice": "join",
    "result": "success",
    "kind": "alternate",
    "text": "당신은 재상에게 사자를 보내 군대의 충성을 약속한다. 왕은 퇴위하고 어린 왕자가 즉위한다. 실권은 재상과 당신에게 넘어간다."
  },
  {
    "id": "frag_sg_capital_coup_join_failure",
    "node": "sg_capital_coup",
    "choice": "join",
    "result": "failure",
    "kind": "alternate",
    "text": "재상 일파는 왕족 군대에 패해 무너진다. 당신이 보낸 서신이 증거로 드러난다. 당신은 반역죄로 처형된다."
  },
  {
    "id": "frag_sg_capital_coup_stay_success",
    "node": "sg_capital_coup",
    "choice": "stay",
    "result": "success",
    "kind": "alternate",
    "text": "당신은 변방의 길목을 막고 어느 편에도 서지 않는다. 수도의 혼란이 길어지는 동안 변방 성채들은 당신의 명령만 따른다. 변방은 사실상 독립한다."
  },
  {
    "id": "frag_sg_capital_coup_stay_failure",
    "node": "sg_capital_coup",
    "choice": "stay",
    "result": "failure",
    "kind": "alternate",
    "text": "당신이 머무는 사이 재상 일파가 수도를 완전히 장악한다. 왕족은 남쪽으로 피신한다. 새 정권은 변방의 군권을 회수하려 한다."
  },
  {
    "id": "frag_sg_capital_coup_allied_restore_success",
    "node": "sg_capital_coup_allied",
    "choice": "restore",
    "result": "success",
    "kind": "alternate",
    "text": "부족 기병이 앞장서 수도의 외성을 넘는다. 재상 일파는 하루 만에 무너진다. 왕은 부족장들에게 조정의 자리를 내준다."
  },
  {
    "id": "frag_sg_capital_coup_allied_restore_failure",
    "node": "sg_capital_coup_allied",
    "choice": "restore",
    "result": "failure",
    "kind": "alternate",
    "text": "수도 사람들은 부족 기병을 침입자로 여겨 성문을 닫는다. 공성이 길어지는 사이 재상 일파가 지방군을 모은다. 당신은 수도를 포기하고 물러난다."
  },
  {
    "id": "frag_sg_capital_coup_allied_found_success",
    "node": "sg_capital_coup_allied",
    "choice": "found",
    "result": "success",
    "kind": "alternate",
    "text": "당신은 변방 성채와 부족 영지를 묶어 새 나라를 선포한다. 수도의 혼란 때문에 서련국은 군대를 보내지 못한다. 변방의 지도가 다시 그려진다."
  },
  {
    "id": "frag_sg_capital_coup_allied_found_failure",
    "node": "sg_capital_coup_allied",
    "choice": "found",
    "result": "failure",
    "kind": "alternate",
    "text": "부족장들 사이에서 왕위를 두고 다툼이 벌어진다. 연회 자리에서 당신은 한 부족장의 칼에 쓰러진다. 새 나라는 세워지지 못한다."
  },
  {
    "id": "frag_sg_capital_coup_allied_dissolve_success",
    "node": "sg_capital_coup_allied",
    "choice": "dissolve",
    "result": "success",
    "kind": "alternate",
    "text": "당신은 부족 기병을 돌려보내고 서련국 병사만 이끌고 수도로 향한다. 수도 사람들이 성문을 열어 당신을 맞는다. 정변은 진압된다."
  },
  {
    "id": "frag_sg_capital_coup_allied_dissolve_failure",
    "node": "sg_capital_coup_allied",
    "choice": "dissolve",
    "result": "failure",
    "kind": "alternate",
    "text": "병력이 모자란 당신의 군대는 수도 앞에서 재상의 군대에 밀린다. 당신은 부상을 입고 퇴각한다. 수도는 재상 일파의 손에 남는다."
  },
  {
    "id": "frag_sg_east_invasion_cross_success",
    "node": "sg_east_invasion",
    "choice": "cross",
    "result": "success",
    "kind": "historical",
    "text": "당신은 새벽 안개를 틈타 강을 건너 적의 선봉을 무너뜨린다. 동하국 군대는 국경 너머로 물러난다. 당신은 그 전투를 끝으로 돌아오지 못한다.",
    "endingLine": "당신은 동하국의 침공을 막고 국경의 강가에서 숨진다.",
    "sources": [
      "가상 데이터 — 실제 사료 아님"
    ],
    "disputed": [
      {
        "note": "이 전투 뒤 당신의 사망 원인을 전사로 적은 기록과 진중 독살로 적은 기록이 엇갈린다. (엔진 시험용 가상 이견)",
        "sources": [
          "가상 데이터 — 실제 사료 아님"
        ]
      }
    ]
  },
  {
    "id": "frag_sg_east_invasion_cross_failure",
    "node": "sg_east_invasion",
    "choice": "cross",
    "result": "failure",
    "kind": "alternate",
    "text": "강을 건너던 당신의 군대가 적의 화살에 막혀 흩어진다. 당신은 부상을 입은 채 살아서 강변을 빠져나온다. 강 서쪽의 마을들이 동하국에 넘어간다."
  },
  {
    "id": "frag_sg_east_invasion_siege_success",
    "node": "sg_east_invasion",
    "choice": "siege",
    "result": "success",
    "kind": "alternate",
    "text": "당신은 성안에 곡식과 화살을 모아 두고 성문을 닫는다. 석 달 동안 성을 넘지 못한 동하국 군대가 물러난다. 당신은 살아서 성벽 위에 선다."
  },
  {
    "id": "frag_sg_east_invasion_siege_failure",
    "node": "sg_east_invasion",
    "choice": "siege",
    "result": "failure",
    "kind": "alternate",
    "text": "성벽 한쪽이 무너지고 적이 성안으로 들어온다. 당신은 남은 병사를 이끌고 후방으로 빠져나온다. 강 서쪽의 땅이 동하국에 넘어간다."
  },
  {
    "id": "frag_sg_east_invasion_peace_success",
    "node": "sg_east_invasion",
    "choice": "peace",
    "result": "success",
    "kind": "alternate",
    "text": "당신은 국경의 성 하나를 내주는 조건으로 화친을 청한다. 동하국 왕이 이를 받아들인다. 두 나라 사이에 교역로가 열린다."
  },
  {
    "id": "frag_sg_east_invasion_peace_failure",
    "node": "sg_east_invasion",
    "choice": "peace",
    "result": "failure",
    "kind": "alternate",
    "text": "동하국은 당신의 사신을 돌려보내지 않는다. 화친을 기다리던 진영이 기습을 받는다. 당신은 그 자리에서 숨진다."
  },
  {
    "id": "frag_sg_after_record_successor_success",
    "node": "sg_after_record",
    "choice": "successor",
    "result": "success",
    "kind": "alternate",
    "text": "당신은 왕자의 즉위식에서 군권의 표식을 내려놓는다. 대신들은 다툼을 멈추고 새 왕을 따른다. 왕위는 무력 충돌 없이 이어진다."
  },
  {
    "id": "frag_sg_after_record_successor_failure",
    "node": "sg_after_record",
    "choice": "successor",
    "result": "failure",
    "kind": "alternate",
    "text": "당신이 물러나자 대신들이 각자 군대를 모은다. 왕자의 즉위는 미뤄지고 지방마다 다른 명령이 내려온다. 서련국은 내전에 들어간다."
  },
  {
    "id": "frag_sg_after_record_crown_success",
    "node": "sg_after_record",
    "choice": "crown",
    "result": "success",
    "kind": "alternate",
    "text": "당신의 군대가 수도에 들어오고 대신들은 당신 앞에 무릎을 꿇는다. 당신은 서련국의 새 왕으로 즉위한다. 반대한 가문들은 수도를 떠난다."
  },
  {
    "id": "frag_sg_after_record_crown_failure",
    "node": "sg_after_record",
    "choice": "crown",
    "result": "failure",
    "kind": "alternate",
    "text": "왕실 근위대가 당신의 군대를 성문 앞에서 막는다. 싸움 중에 당신은 쓰러진다. 서련국은 내전에 들어간다."
  },
  {
    "id": "frag_sg_after_record_frontier_success",
    "node": "sg_after_record",
    "choice": "frontier",
    "result": "success",
    "kind": "alternate",
    "text": "당신은 병사들과 함께 변방의 황무지에 둑을 쌓고 밭을 일군다. 조정의 다툼은 변방까지 번지지 않는다. 변방에 새 마을들이 생긴다."
  },
  {
    "id": "frag_sg_after_record_frontier_failure",
    "node": "sg_after_record",
    "choice": "frontier",
    "result": "failure",
    "kind": "alternate",
    "text": "개척지에 가뭄이 들고 병사들이 흩어진다. 그 사이 조정의 다툼은 무력 충돌로 번진다. 서련국은 내전에 들어간다."
  }
]
