[
  {
    "id": "frag_sc_pirates_assault_success",
    "node": "sc_pirates",
    "choice": "assault",
    "result": "success",
    "kind": "historical",
    "text": "당신은 선단을 이끌고 해적의 근거지 섬을 정면으로 친다. 섬은 함락된다. 공격 중 섬 가까운 해안 마을 주민들도 피해를 입는다.",
    "endingLine": "해적의 섬은 바르니아 선단에 떨어진다.",
    "sources": [
      "Annales Varniae (가상 사료) II.9",
      "A Fictional Chronicle of Varnia (가상 사료) ch.4"
    ]
  },
  {
    "id": "frag_sc_pirates_assault_failure",
    "node": "sc_pirates",
    "choice": "assault",
    "result": "failure",
    "kind": "alternate",
    "text": "섬의 절벽에서 쏟아진 불화살이 당신의 배들을 태운다. 남은 배를 모아 돌아오지만 선단의 절반이 바다에 가라앉는다."
  },
  {
    "id": "frag_sc_pirates_hire_success",
    "node": "sc_pirates",
    "choice": "hire",
    "result": "success",
    "kind": "alternate",
    "text": "당신은 해적 두목과 마주 앉아 배와 급료를 약속한다. 해적선들이 바르니아의 깃발을 달고 상선을 호위하기 시작한다."
  },
  {
    "id": "frag_sc_pirates_hire_failure",
    "node": "sc_pirates",
    "choice": "hire",
    "result": "failure",
    "kind": "alternate",
    "text": "협상 자리에서 해적들이 칼을 뽑는다. 당신은 간신히 빠져나오지만 협상에 데려간 배들을 모두 잃는다."
  },
  {
    "id": "frag_sc_pirates_blockade_success",
    "node": "sc_pirates",
    "choice": "blockade",
    "result": "success",
    "kind": "alternate",
    "text": "당신의 배들이 섬을 둘러싸고 한 철을 버틴다. 굶주린 해적들이 하나둘 배를 버리고 항복한다."
  },
  {
    "id": "frag_sc_pirates_blockade_failure",
    "node": "sc_pirates",
    "choice": "blockade",
    "result": "failure",
    "kind": "alternate",
    "text": "폭풍이 봉쇄선을 흩어 놓는다. 해적들은 그 틈에 빠져나가 더 먼 바다에 새 근거지를 세운다."
  },
  {
    "id": "frag_sc_grain_ration_law_success",
    "node": "sc_grain",
    "choice": "ration_law",
    "result": "success",
    "kind": "historical",
    "text": "당신은 원로원에 곡물 배급법을 제안한다. 법안은 원로원을 통과한다.",
    "endingLine": "곡물 배급법이 바르니아에 남는다.",
    "sources": [
      "Annales Varniae (가상 사료) III.2"
    ]
  },
  {
    "id": "frag_sc_grain_ration_law_failure",
    "node": "sc_grain",
    "choice": "ration_law",
    "result": "failure",
    "kind": "alternate",
    "text": "원로원은 당신의 법안을 부결한다. 빵값은 계속 오르고 시장에서 폭동이 일어난다."
  },
  {
    "id": "frag_sc_grain_seize_ships_success",
    "node": "sc_grain",
    "choice": "seize_ships",
    "result": "success",
    "kind": "alternate",
    "text": "당신의 병사들이 항구에 든 상선의 곡물을 내린다. 시장의 빵값은 내려가지만 외국 상인들의 발길이 끊긴다."
  },
  {
    "id": "frag_sc_grain_seize_ships_failure",
    "node": "sc_grain",
    "choice": "seize_ships",
    "result": "failure",
    "kind": "alternate",
    "text": "상선의 선원들이 징발에 맞서 부두를 막는다. 싸움이 시장으로 번져 폭동이 된다."
  },
  {
    "id": "frag_sc_grain_east_import_success",
    "node": "sc_grain",
    "choice": "east_import",
    "result": "success",
    "kind": "alternate",
    "text": "당신이 보낸 사절이 동방의 항구들과 곡물 계약을 맺는다. 다음 해부터 동방 곡물선이 포르투스 노부스에 닿는다."
  },
  {
    "id": "frag_sc_grain_east_import_failure",
    "node": "sc_grain",
    "choice": "east_import",
    "result": "failure",
    "kind": "alternate",
    "text": "동방의 곡물선은 너무 늦게 도착한다. 기다리다 지친 시민들이 창고를 부순다."
  },
  {
    "id": "frag_sc_north_treaty_success",
    "node": "sc_north",
    "choice": "treaty",
    "result": "success",
    "kind": "historical",
    "text": "당신은 북방 부족 연합과 동맹 조약을 맺는다. 조약을 맺은 장소는 기록마다 다르게 전한다.",
    "endingLine": "북방 부족 연합과의 동맹이 맺어진다.",
    "sources": [
      "A Fictional Chronicle of Varnia (가상 사료) ch.9"
    ],
    "disputed": [
      {
        "note": "조약을 맺은 장소: 연구서는 국경 요새라고 쓰고, 연구서가 인용한 다른 전승은 포르투스 노부스라고 한다.",
        "sources": [
          "A Fictional Chronicle of Varnia (가상 사료) ch.9"
        ]
      }
    ]
  },
  {
    "id": "frag_sc_north_treaty_failure",
    "node": "sc_north",
    "choice": "treaty",
    "result": "failure",
    "kind": "alternate",
    "text": "조약 문구를 두고 협상이 깨진다. 북방 기병이 국경 마을들을 습격하기 시작한다."
  },
  {
    "id": "frag_sc_north_campaign_success",
    "node": "sc_north",
    "choice": "campaign",
    "result": "success",
    "kind": "alternate",
    "text": "당신의 군대가 북방 부족 연합의 겨울 진영을 무너뜨린다. 북쪽 땅이 바르니아에 편입된다."
  },
  {
    "id": "frag_sc_north_campaign_failure",
    "node": "sc_north",
    "choice": "campaign",
    "result": "failure",
    "kind": "alternate",
    "text": "북방의 눈보라 속에서 원정군이 길을 잃는다. 당신은 다리를 다친 채 돌아오고 국경 전쟁이 길어진다."
  },
  {
    "id": "frag_sc_north_retreat_success",
    "node": "sc_north",
    "choice": "retreat",
    "result": "success",
    "kind": "alternate",
    "text": "당신은 국경 마을 사람들을 이끌고 남쪽 섬으로 옮긴다. 바르니아의 중심이 바다 쪽으로 내려간다."
  },
  {
    "id": "frag_sc_north_retreat_failure",
    "node": "sc_north",
    "choice": "retreat",
    "result": "failure",
    "kind": "alternate",
    "text": "물러나는 행렬을 북방 기병이 뒤쫓는다. 국경 전역에서 싸움이 벌어진다."
  },
  {
    "id": "frag_sc_heir_name_heir_success",
    "node": "sc_heir",
    "choice": "name_heir",
    "result": "success",
    "kind": "alternate",
    "text": "당신이 지명한 후계자를 원로원이 받아들인다. 권력은 다툼 없이 넘어간다."
  },
  {
    "id": "frag_sc_heir_name_heir_failure",
    "node": "sc_heir",
    "choice": "name_heir",
    "result": "failure",
    "kind": "alternate",
    "text": "원로원의 두 파가 서로 다른 후계자를 내세운다. 회의장은 고성으로 가득하다."
  },
  {
    "id": "frag_sc_heir_reform_success",
    "node": "sc_heir",
    "choice": "reform",
    "result": "success",
    "kind": "alternate",
    "text": "당신은 원로원 의장을 추첨과 투표로 함께 뽑는 규칙을 만든다. 새 규칙으로 뽑힌 첫 의장이 취임한다."
  },
  {
    "id": "frag_sc_heir_reform_failure",
    "node": "sc_heir",
    "choice": "reform",
    "result": "failure",
    "kind": "alternate",
    "text": "개혁안은 옛 가문들의 반대에 막힌다. 후계를 둘러싼 다툼만 커진다."
  }
]
